query,response,facts,time_taken_sec,clarity_score,accuracy,releveance,completeness,effectiveness
SIP total in 2024 vs 2023 for HDFC Equity Growth,"According to the provided data, HDFC Equity Growth’s SIP total for 2024 was 7200.0, compared to 6000.0 in 2023. This represents a 20.0% increase in SIP total over the period.","{""type"": ""sip_summary"", ""year"": 2024, ""fund_name"": ""HDFC Equity Growth"", ""total_this"": 7200.0, ""total_prev"": 6000.0, ""yoy"": 20.0}",9.294861317,3,100%,5,100%,75%
Latest NAV for icici,"As of December 2, 2025, the latest NAV for ICICI is 248.55. This figure represents the current net asset value of the bank’s assets and liabilities, providing an updated snapshot of its financial health.  This number reflects a significant development in the bank’s financial standing.","{""type"": ""latest_nav"", ""fund_name"": ""icici"", ""date"": ""2025-12-02"", ""nav_value"": 248.55}",6.411097527,2,100%,4,100%,75%
How much did I invest last year in my hdfc equity plan?,I do not have access to your personal investment details.,{},5.959005117,3,0%,1,0%,75%
Can you tell me the nav right now for icici equity?,"As of today, December 2, 2025, the latest NAV for ICICI Equity is 248.55.",{},4.858959675,3,0%,1,100%,75%
What is a systematic investment plan?,A systematic investment plan (SIP) is a regular investment where you invest a fixed amount each period.,{},6.620184898,2,100%,5,100%,75%
Explain what NAV means in simple terms.,"NAV is like the ""cost"" of an investment s the price you pay to own a piece of a company's stock.",{},6.956514359,4,100%,5,100%,75%
"What is my SIP total in 2024 for sbi, and what exactly is SIP?","Your SIP (Shareholder Investment Plan) total for 2024 is $5400.00, and it's a plan offered by SBI, designed to help investors manage their money and achieve their financial goals. This SIP includes a total of five thousand dollars.","{""type"": ""sip_summary"", ""year"": 2024, ""fund_name"": ""sbi"", ""total_this"": 5400.0}",8.061866522,4,100%,4,50%,75%
"What is the latest NAV for SBI, and how does NAV affect my returns?","As of December 2nd, 2025, the latest NAV for SBI is ₹364.4.  NAV is a measure of a fund’s net asset value, and it significantly impacts returns because it represents the market value of the fund’s assets minus liabilities, reflecting the fund’s overall health and investment performance.  A higher NAV generally suggests better performance and potentially more favorable returns for investors.","{""type"": ""latest_nav"", ""fund_name"": ""SBI"", ""date"": ""2025-12-02"", ""nav_value"": 364.4}",7.249845028,2,100%,5,100%,75%
